{
  "curation": {
    "category_override": null,
    "claimed_intent_override": null,
    "notes": "",
    "review_status": "unreviewed",
    "source_override": null
  },
  "duplicates": {
    "is_duplicate": false,
    "matching_relative_paths": []
  },
  "identity": {
    "hash_algorithm": "sha256",
    "sha256": "e19efae641f5fe78c1fccaaf004b452e7d7585c0ded2942b2970259d26bea5fc"
  },
  "inferred_labels": {
    "basis": "corpus_directory_structure",
    "category": "focus",
    "claimed_intent": "deep_work",
    "source": "brainfm"
  },
  "manifest_schema_version": "1.0.0",
  "media": {
    "channels": 2,
    "codec_subtype": "MPEG_LAYER_III",
    "container_extension": ".mp3",
    "duration_seconds": 1800.0,
    "frame_count": 79380000,
    "sample_rate": 44100,
    "size_bytes": 20821892
  },
  "provenance": {
    "generator": "corpus.manifests",
    "generator_version": "1.0.0",
    "source": "local_corpus_file"
  },
  "recording_id": "ave_recording_e19efae641f5fe78",
  "relative_path": "brainfm/focus/deep_work/Deep Stirrings - NewDrone1_1.30_Nrmlzd2_VBR5.mp3"
}
