{
  "curation": {
    "category_override": null,
    "claimed_intent_override": null,
    "notes": "",
    "review_status": "unreviewed",
    "source_override": null
  },
  "duplicates": {
    "is_duplicate": true,
    "matching_relative_paths": [
      "brainfm/sleep/guided_sleep/Afterthought_Sleep_DeepSleep_Atmospheric_60_120bpm_Nrmlzd2_VBR5.mp3"
    ]
  },
  "identity": {
    "hash_algorithm": "sha256",
    "sha256": "764837c377e5c0914849b8581deb0a7c5fe8a6bdc29593a411c6429951d6bf33"
  },
  "inferred_labels": {
    "basis": "corpus_directory_structure",
    "category": "sleep",
    "claimed_intent": "sleep_and_wake",
    "source": "brainfm"
  },
  "manifest_schema_version": "1.0.0",
  "media": {
    "channels": 2,
    "codec_subtype": "MPEG_LAYER_III",
    "container_extension": ".mp3",
    "duration_seconds": 3600.0,
    "frame_count": 158760000,
    "sample_rate": 44100,
    "size_bytes": 40861161
  },
  "provenance": {
    "generator": "corpus.manifests",
    "generator_version": "1.0.0",
    "source": "local_corpus_file"
  },
  "recording_id": "ave_recording_764837c377e5c091",
  "relative_path": "brainfm/sleep/sleep_and_wake/Afterthought_Sleep_DeepSleep_Atmospheric_60_120bpm_Nrmlzd2_VBR5.mp3"
}
