{
  "curation": {
    "category_override": null,
    "claimed_intent_override": null,
    "notes": "",
    "review_status": "unreviewed",
    "source_override": null
  },
  "duplicates": {
    "is_duplicate": false,
    "matching_relative_paths": []
  },
  "identity": {
    "hash_algorithm": "sha256",
    "sha256": "a183b4833fea43ce7891a8537e321291f0014283c081834a8fcfd94372276efb"
  },
  "inferred_labels": {
    "basis": "corpus_directory_structure",
    "category": "sleep",
    "claimed_intent": "wind_down",
    "source": "brainfm"
  },
  "manifest_schema_version": "1.0.0",
  "media": {
    "channels": 2,
    "codec_subtype": "MPEG_LAYER_III",
    "container_extension": ".mp3",
    "duration_seconds": 3600.0,
    "frame_count": 158760000,
    "sample_rate": 44100,
    "size_bytes": 46067573
  },
  "provenance": {
    "generator": "corpus.manifests",
    "generator_version": "1.0.0",
    "source": "local_corpus_file"
  },
  "recording_id": "ave_recording_a183b4833fea43ce",
  "relative_path": "brainfm/sleep/wind_down/ChorusSpace_Sleep_PowerNap_Atmospheric_60_120bpm_MedNEL_Nrmlzd2_VBR5.mp3"
}
