{
  "curation": {
    "category_override": null,
    "claimed_intent_override": null,
    "notes": "",
    "review_status": "unreviewed",
    "source_override": null
  },
  "duplicates": {
    "is_duplicate": false,
    "matching_relative_paths": []
  },
  "identity": {
    "hash_algorithm": "sha256",
    "sha256": "8934e6ceb2b85d578a1fd00cf2fd100d138d3628faae77dddbf6350cb7091fe0"
  },
  "inferred_labels": {
    "basis": "corpus_directory_structure",
    "category": "sleep",
    "claimed_intent": "deep_sleep",
    "source": "brainfm"
  },
  "manifest_schema_version": "1.0.0",
  "media": {
    "channels": 2,
    "codec_subtype": "MPEG_LAYER_III",
    "container_extension": ".mp3",
    "duration_seconds": 3600.0,
    "frame_count": 172800000,
    "sample_rate": 48000,
    "size_bytes": 44318400
  },
  "provenance": {
    "generator": "corpus.manifests",
    "generator_version": "1.0.0",
    "source": "local_corpus_file"
  },
  "recording_id": "ave_recording_8934e6ceb2b85d57",
  "relative_path": "brainfm/sleep/deep_sleep/BetweenDimensions_Sleep_DeepSleep_60_120bpm_HighNEL_Nrmlzd2_VBR5.mp3"
}
