{
  "curation": {
    "category_override": null,
    "claimed_intent_override": null,
    "notes": "",
    "review_status": "unreviewed",
    "source_override": null
  },
  "duplicates": {
    "is_duplicate": false,
    "matching_relative_paths": []
  },
  "identity": {
    "hash_algorithm": "sha256",
    "sha256": "06568cbc3f8cc82961dec4a86c20b25ced180e766ced723c359b14af25a5032e"
  },
  "inferred_labels": {
    "basis": "corpus_directory_structure",
    "category": "focus",
    "claimed_intent": "learning",
    "source": "brainfm"
  },
  "manifest_schema_version": "1.0.0",
  "media": {
    "channels": 2,
    "codec_subtype": "MPEG_LAYER_III",
    "container_extension": ".mp3",
    "duration_seconds": 1800.0,
    "frame_count": 79380000,
    "sample_rate": 44100,
    "size_bytes": 28837010
  },
  "provenance": {
    "generator": "corpus.manifests",
    "generator_version": "1.0.0",
    "source": "local_corpus_file"
  },
  "recording_id": "ave_recording_06568cbc3f8cc829",
  "relative_path": "brainfm/focus/learning/Misspelled Monologue_Focus_Learning_Electronic_30_125bpm_MedNEL_Nrmlzd2_VBR5.mp3"
}
