{
  "curation": {
    "category_override": null,
    "claimed_intent_override": null,
    "notes": "",
    "review_status": "unreviewed",
    "source_override": null
  },
  "duplicates": {
    "is_duplicate": false,
    "matching_relative_paths": []
  },
  "identity": {
    "hash_algorithm": "sha256",
    "sha256": "717bb27727c405b1393399d2c4d9edc26bd6e3f36ee4e0eae243ceeeced7abe5"
  },
  "inferred_labels": {
    "basis": "corpus_directory_structure",
    "category": "meditate",
    "claimed_intent": "unguided",
    "source": "brainfm"
  },
  "manifest_schema_version": "1.0.0",
  "media": {
    "channels": 2,
    "codec_subtype": "MPEG_LAYER_III",
    "container_extension": ".mp3",
    "duration_seconds": 900.0,
    "frame_count": 39690000,
    "sample_rate": 44100,
    "size_bytes": 11226200
  },
  "provenance": {
    "generator": "corpus.manifests",
    "generator_version": "1.0.0",
    "source": "local_corpus_file"
  },
  "recording_id": "ave_recording_717bb27727c405b1",
  "relative_path": "brainfm/meditate/unguided/Altered_State_Unguided_Meditation_Session_4_1.2_Nrmlzd2 1_15mins_VBR5.mp3"
}
