{
  "curation": {
    "category_override": null,
    "claimed_intent_override": null,
    "notes": "",
    "review_status": "unreviewed",
    "source_override": null
  },
  "duplicates": {
    "is_duplicate": false,
    "matching_relative_paths": []
  },
  "identity": {
    "hash_algorithm": "sha256",
    "sha256": "06c5b270296472cda96eee18f5868badf5816af00d2b86a219d7b0124fdad935"
  },
  "inferred_labels": {
    "basis": "corpus_directory_structure",
    "category": "meditate",
    "claimed_intent": "unguided",
    "source": "brainfm"
  },
  "manifest_schema_version": "1.0.0",
  "media": {
    "channels": 2,
    "codec_subtype": "MPEG_LAYER_III",
    "container_extension": ".mp3",
    "duration_seconds": 900.0,
    "frame_count": 39690000,
    "sample_rate": 44100,
    "size_bytes": 12707907
  },
  "provenance": {
    "generator": "corpus.manifests",
    "generator_version": "1.0.0",
    "source": "local_corpus_file"
  },
  "recording_id": "ave_recording_06c5b270296472cd",
  "relative_path": "brainfm/meditate/unguided/Catharsis_Meditate_UnguidedMeditation_Atmospheric_15_120bpm_HighNEL_Nrmlzd2_VBR5.mp3"
}
