{
  "curation": {
    "category_override": null,
    "claimed_intent_override": null,
    "notes": "",
    "review_status": "unreviewed",
    "source_override": null
  },
  "duplicates": {
    "is_duplicate": false,
    "matching_relative_paths": []
  },
  "identity": {
    "hash_algorithm": "sha256",
    "sha256": "17fcae437275a5eebcb4836e49daf788f8932aa4165d4c7bacbc31ba3f51d0f1"
  },
  "inferred_labels": {
    "basis": "corpus_directory_structure",
    "category": "focus",
    "claimed_intent": "light_work",
    "source": "brainfm"
  },
  "manifest_schema_version": "1.0.0",
  "media": {
    "channels": 2,
    "codec_subtype": "MPEG_LAYER_III",
    "container_extension": ".mp3",
    "duration_seconds": 1800.0,
    "frame_count": 79380000,
    "sample_rate": 44100,
    "size_bytes": 27141628
  },
  "provenance": {
    "generator": "corpus.manifests",
    "generator_version": "1.0.0",
    "source": "local_corpus_file"
  },
  "recording_id": "ave_recording_17fcae437275a5ee",
  "relative_path": "brainfm/focus/light_work/Worth_It_Focus_Learning_LoFi_30_86bpm_MedNEL_Nrmlzd2_VBR5.mp3"
}
