{
  "curation": {
    "category_override": null,
    "claimed_intent_override": null,
    "notes": "",
    "review_status": "unreviewed",
    "source_override": null
  },
  "duplicates": {
    "is_duplicate": false,
    "matching_relative_paths": []
  },
  "identity": {
    "hash_algorithm": "sha256",
    "sha256": "edaf66e587aea909b27dd8d5c504fb8087c2af8c5c82547372354465e3c7bd9c"
  },
  "inferred_labels": {
    "basis": "corpus_directory_structure",
    "category": "sleep",
    "claimed_intent": "sleep_and_wake",
    "source": "brainfm"
  },
  "manifest_schema_version": "1.0.0",
  "media": {
    "channels": 2,
    "codec_subtype": "MPEG_LAYER_III",
    "container_extension": ".mp3",
    "duration_seconds": 3600.0,
    "frame_count": 158760000,
    "sample_rate": 44100,
    "size_bytes": 42971807
  },
  "provenance": {
    "generator": "corpus.manifests",
    "generator_version": "1.0.0",
    "source": "local_corpus_file"
  },
  "recording_id": "ave_recording_edaf66e587aea909",
  "relative_path": "brainfm/sleep/sleep_and_wake/SoloTraveler_Sleep_DeepSleep_60_120bpm_HighNEL_VBR5.mp3"
}
