{
  "curation": {
    "category_override": null,
    "claimed_intent_override": null,
    "notes": "",
    "review_status": "unreviewed",
    "source_override": null
  },
  "duplicates": {
    "is_duplicate": false,
    "matching_relative_paths": []
  },
  "identity": {
    "hash_algorithm": "sha256",
    "sha256": "a51c4568980eff94e44b216658d4373342c816f1cb549e0edabce0175af6dc70"
  },
  "inferred_labels": {
    "basis": "corpus_directory_structure",
    "category": "focus",
    "claimed_intent": "learning",
    "source": "brainfm"
  },
  "manifest_schema_version": "1.0.0",
  "media": {
    "channels": 2,
    "codec_subtype": "MPEG_LAYER_III",
    "container_extension": ".mp3",
    "duration_seconds": 1800.0,
    "frame_count": 79380000,
    "sample_rate": 44100,
    "size_bytes": 20115216
  },
  "provenance": {
    "generator": "corpus.manifests",
    "generator_version": "1.0.0",
    "source": "local_corpus_file"
  },
  "recording_id": "ave_recording_a51c4568980eff94",
  "relative_path": "brainfm/focus/learning/Focus2Session4.6_VBR5.mp3"
}
