{
  "curation": {
    "category_override": null,
    "claimed_intent_override": null,
    "notes": "",
    "review_status": "unreviewed",
    "source_override": null
  },
  "duplicates": {
    "is_duplicate": false,
    "matching_relative_paths": []
  },
  "identity": {
    "hash_algorithm": "sha256",
    "sha256": "58fe208661a26a601010fd00fdf79d52b4dfe63fa6b75471c46679c7cfa2b0f6"
  },
  "inferred_labels": {
    "basis": "corpus_directory_structure",
    "category": "focus",
    "claimed_intent": "creativity",
    "source": "brainfm"
  },
  "manifest_schema_version": "1.0.0",
  "media": {
    "channels": 2,
    "codec_subtype": "MPEG_LAYER_III",
    "container_extension": ".mp3",
    "duration_seconds": 1800.0,
    "frame_count": 79380000,
    "sample_rate": 44100,
    "size_bytes": 26088280
  },
  "provenance": {
    "generator": "corpus.manifests",
    "generator_version": "1.0.0",
    "source": "local_corpus_file"
  },
  "recording_id": "ave_recording_58fe208661a26a60",
  "relative_path": "brainfm/focus/creativity/MagneticPulse_Focus_Creativity_Electronic_30_125bpm_Nrmlzd2_VBR5.mp3"
}
