{
  "curation": {
    "category_override": null,
    "claimed_intent_override": null,
    "notes": "",
    "review_status": "unreviewed",
    "source_override": null
  },
  "duplicates": {
    "is_duplicate": false,
    "matching_relative_paths": []
  },
  "identity": {
    "hash_algorithm": "sha256",
    "sha256": "89e30c2988bc4878bcaa57c7fd3f6725a138874aa2480b999a8bd2344283a987"
  },
  "inferred_labels": {
    "basis": "corpus_directory_structure",
    "category": "meditate",
    "claimed_intent": "unguided",
    "source": "brainfm"
  },
  "manifest_schema_version": "1.0.0",
  "media": {
    "channels": 2,
    "codec_subtype": "MPEG_LAYER_III",
    "container_extension": ".mp3",
    "duration_seconds": 900.0,
    "frame_count": 39690000,
    "sample_rate": 44100,
    "size_bytes": 13429231
  },
  "provenance": {
    "generator": "corpus.manifests",
    "generator_version": "1.0.0",
    "source": "local_corpus_file"
  },
  "recording_id": "ave_recording_89e30c2988bc4878",
  "relative_path": "brainfm/meditate/unguided/CauseandEffect_Meditate_UnguidedMeditation_Electronic_15_120bpm_MedNEL_Nrmlzd2_VBR5.mp3"
}
