{
  "curation": {
    "category_override": null,
    "claimed_intent_override": null,
    "notes": "",
    "review_status": "unreviewed",
    "source_override": null
  },
  "duplicates": {
    "is_duplicate": true,
    "matching_relative_paths": [
      "brainfm/sleep/deep_sleep/LucidDreams_Sleep_DeepSleep_Atmospheric_60_120bpm_Nrmlzd2_VBR5.mp3"
    ]
  },
  "identity": {
    "hash_algorithm": "sha256",
    "sha256": "92868f1409ea9f30cac58b955f86fffa534ae105ed2aee0c5953ecb7d7579409"
  },
  "inferred_labels": {
    "basis": "corpus_directory_structure",
    "category": "sleep",
    "claimed_intent": "wind_down",
    "source": "brainfm"
  },
  "manifest_schema_version": "1.0.0",
  "media": {
    "channels": 2,
    "codec_subtype": "MPEG_LAYER_III",
    "container_extension": ".mp3",
    "duration_seconds": 3600.0,
    "frame_count": 158760000,
    "sample_rate": 44100,
    "size_bytes": 38907627
  },
  "provenance": {
    "generator": "corpus.manifests",
    "generator_version": "1.0.0",
    "source": "local_corpus_file"
  },
  "recording_id": "ave_recording_92868f1409ea9f30",
  "relative_path": "brainfm/sleep/wind_down/LucidDreams_Sleep_DeepSleep_Atmospheric_60_120bpm_Nrmlzd2_VBR5.mp3"
}
