{
  "curation": {
    "category_override": null,
    "claimed_intent_override": null,
    "notes": "",
    "review_status": "unreviewed",
    "source_override": null
  },
  "duplicates": {
    "is_duplicate": false,
    "matching_relative_paths": []
  },
  "identity": {
    "hash_algorithm": "sha256",
    "sha256": "2ec1a463e68f0a199b3cfdf54b596d0a864baab6aa01d0646d7095695253a106"
  },
  "inferred_labels": {
    "basis": "corpus_directory_structure",
    "category": "meditate",
    "claimed_intent": "unguided",
    "source": "brainfm"
  },
  "manifest_schema_version": "1.0.0",
  "media": {
    "channels": 2,
    "codec_subtype": "MPEG_LAYER_III",
    "container_extension": ".mp3",
    "duration_seconds": 3600.0,
    "frame_count": 158760000,
    "sample_rate": 44100,
    "size_bytes": 51954905
  },
  "provenance": {
    "generator": "corpus.manifests",
    "generator_version": "1.0.0",
    "source": "local_corpus_file"
  },
  "recording_id": "ave_recording_2ec1a463e68f0a19",
  "relative_path": "brainfm/meditate/unguided/Meditation2_60mins_VBR5.mp3"
}
