{
  "curation": {
    "category_override": null,
    "claimed_intent_override": null,
    "notes": "",
    "review_status": "unreviewed",
    "source_override": null
  },
  "duplicates": {
    "is_duplicate": false,
    "matching_relative_paths": []
  },
  "identity": {
    "hash_algorithm": "sha256",
    "sha256": "d42615dbbb1ffe0786c9661ef3a5058b588b60847117e8e4a8e0c4119bf8693d"
  },
  "inferred_labels": {
    "basis": "corpus_directory_structure",
    "category": "meditate",
    "claimed_intent": "unguided",
    "source": "brainfm"
  },
  "manifest_schema_version": "1.0.0",
  "media": {
    "channels": 2,
    "codec_subtype": "MPEG_LAYER_III",
    "container_extension": ".mp3",
    "duration_seconds": 900.0,
    "frame_count": 39690000,
    "sample_rate": 44100,
    "size_bytes": 13566545
  },
  "provenance": {
    "generator": "corpus.manifests",
    "generator_version": "1.0.0",
    "source": "local_corpus_file"
  },
  "recording_id": "ave_recording_d42615dbbb1ffe07",
  "relative_path": "brainfm/meditate/unguided/Ascension_Meditate_Unguided_Atmospheric_30_120bpm_MedNEL_Nrmlzd2_VBR5.mp3"
}
