{
  "curation": {
    "category_override": null,
    "claimed_intent_override": null,
    "notes": "",
    "review_status": "unreviewed",
    "source_override": null
  },
  "duplicates": {
    "is_duplicate": true,
    "matching_relative_paths": [
      "brainfm/meditate/unguided/Celestial_Wanderings_Unguided_Meditation_60mins_VBR5.mp3"
    ]
  },
  "identity": {
    "hash_algorithm": "sha256",
    "sha256": "99ea678cc85d322512bedaf48b5ec73b93e3eb7efb7171247cd189b5068ba1c1"
  },
  "inferred_labels": {
    "basis": "corpus_directory_structure",
    "category": "meditate",
    "claimed_intent": "unguided",
    "source": "brainfm"
  },
  "manifest_schema_version": "1.0.0",
  "media": {
    "channels": 2,
    "codec_subtype": "MPEG_LAYER_III",
    "container_extension": ".mp3",
    "duration_seconds": 3600.0,
    "frame_count": 158760000,
    "sample_rate": 44100,
    "size_bytes": 41265126
  },
  "provenance": {
    "generator": "corpus.manifests",
    "generator_version": "1.0.0",
    "source": "local_corpus_file"
  },
  "recording_id": "ave_recording_99ea678cc85d3225",
  "relative_path": "brainfm/meditate/unguided/Celestial Wanderings Unguided Meditation Conor_1.9_Nrmlzd2_60mins_VBR5.mp3"
}
