{
  "curation": {
    "category_override": null,
    "claimed_intent_override": null,
    "notes": "",
    "review_status": "unreviewed",
    "source_override": null
  },
  "duplicates": {
    "is_duplicate": false,
    "matching_relative_paths": []
  },
  "identity": {
    "hash_algorithm": "sha256",
    "sha256": "7fd72867ea3531594af0f8cf52c57ace0578acdf87bbf8e8f7e4c727ab821a86"
  },
  "inferred_labels": {
    "basis": "corpus_directory_structure",
    "category": "sleep",
    "claimed_intent": "wind_down",
    "source": "brainfm"
  },
  "manifest_schema_version": "1.0.0",
  "media": {
    "channels": 2,
    "codec_subtype": "MPEG_LAYER_III",
    "container_extension": ".mp3",
    "duration_seconds": 900.0,
    "frame_count": 39690000,
    "sample_rate": 44100,
    "size_bytes": 11070209
  },
  "provenance": {
    "generator": "corpus.manifests",
    "generator_version": "1.0.0",
    "source": "local_corpus_file"
  },
  "recording_id": "ave_recording_7fd72867ea353159",
  "relative_path": "brainfm/sleep/wind_down/LotusBlossom_Relax_Recharge_Atmospheric_15_120bpm_HighNEL_Nrmlzd2_VBR5.mp3"
}
